발명의명칭,출원인,출원일자,심사진행상태
마이크로 LED 및 이를 포함하는 디스플레이 장치(MICRO LED AND DISPLAY DEVICE COMPRISING THE SAME),주식회사 엘지화학(서울특별시 영등포구...),2018.01.25,등록결정(재심사후)
슬라이드 방식의 LED 패키지 장착 구조를 갖는 백 라이트 유닛(BACK LIGHT UNIT HAVING SLIDING MOUNT STRUCTURE FOR LED PACKAGE),엘지디스플레이 주식회사(서울특별시 영등포구...),2010.02.17,거절결정(일반)
LED 표시장치(Light emitting diode(LED) display device),엘지디스플레이 주식회사(서울특별시 영등포구...),2019.12.27,
LED 디스플레이 장치 및 그것의 제조 방법(LED DISPLAY APPARATUS AND MANUFACTURING METHOD THEREOF),엘지전자 주식회사(서울특별시 영등포구...),2012.02.13,거절결정(일반)
LED 백 라이트 시스템(LED BACK LIGHT SYSTEM),엘지디스플레이 주식회사(서울특별시 영등포구...),2007.04.20,등록결정(심사전치후)
양자점 및 이를 이용한 LED 패키지(QUANTUM DOT AND LED PAKAGE USING THE SAME),엘지디스플레이 주식회사(서울특별시 영등포구...),2011.10.25,거절결정(재심사)
LED 조명기구 및 그 제조방법(LED Lighting Device and Method of manufacturing thereof),엘지전자 주식회사(서울특별시 영등포구...),2010.06.23,등록결정(일반)
LED 프로젝터 및 이미지 영역 이동 방법(LED projector and method of moving image area),엘지전자 주식회사(서울특별시 영등포구...),2009.12.23,거절결정(일반)
마이크로 LED를 이용한 디스플레이 장치 및 이의 제조 방법(DISPLAY DEVICE USING MICRO LED AND MANUFACTURING METHOD THEREOF),엘지전자 주식회사(서울특별시 영등포구...),2019.09.26,
마이크로LED 표시장치 및 그 구동방법(MICRO LED DISPLAY DEVICE AND METHOD OF DRIVING THEREOF),엘지디스플레이 주식회사(서울특별시 영등포구...),2017.12.27,
LED 표시장치 및 이의 제조방법(LED DISPLAY APPARATUS AND MANUFACTURING METHOD OF THE SAME),엘지디스플레이 주식회사(서울특별시 영등포구...),2019.12.26,
LED 전압 구동 회로(LED voltage driver circuit),엘지이노텍 주식회사(서울특별시 강서구...),2015.12.28,등록결정(일반)
LED 조명용 전원 장치 및 그의 저전압 보호 방법(POWER APPARATUS FOR LED LIGHTING AND UNDER VOLTAGE PROTECTION METHOD OF THE SAME),엘지이노텍 주식회사(서울특별시 강서구...),2016.01.05,등록결정(일반)
분산 전원 구조를 구비한 LED 디스플레이 유닛(LED display unit with a distributed power architecture),엘지이노텍 주식회사(서울특별시 강서구...),2016.03.28,
LED 표시장치 및 LED소자 제조방법(Light emitting diode(LED) display device and method for manufacturing LED),엘지디스플레이 주식회사(서울특별시 영등포구...),2019.12.24,
LED 디스플레이 패널 및 이를 이용한 디스플레이 장치(LED DISPLAY PANEL AND DISPLAY DEVICE USING THE SAME),엘지디스플레이 주식회사(서울특별시 영등포구...),2022.10.07,
LED 어레이 및 이를 포함하는 액정표시장치모듈(LED ARRAY AND LCD MODULE INCLUDING THE SAME),엘지디스플레이 주식회사(서울특별시 영등포구...),2010.12.15,등록결정(일반)
LED 이송 장치(LED TRANSFERING APPARATUS),엘지디스플레이 주식회사(서울특별시 영등포구...),2019.12.24,
LED 램프 유닛(LED LAMP UNIT),엘지디스플레이 주식회사(서울특별시 영등포구...),2004.04.29,등록결정(일반)
"마이크로 LED 전사 방법, 이를 이용한 마이크로 LED 표시 패널 제조 방법 및 마이크로 LED 표시 패널(METHOD OF TRANSFERRING MICRO LED, METHOD OF MANUFACTURING MICRO LED DISPLAY PANEL USING THE SAME AND MICRO LED DISPLAY PANEL)",엘지디스플레이 주식회사(서울특별시 영등포구...),2017.12.27,등록결정(일반)
LED 전원 장치.(POWER DEVICE FOR LED LIGHTING),엘지이노텍 주식회사(서울특별시 강서구...),2012.03.13,등록결정(일반)
LED 디스플레이 패널 및 이를 이용한 디스플레이 장치(LED DISPLAY PANEL AND DISPLAY DEVICE USING THE SAME),엘지디스플레이 주식회사(서울특별시 영등포구...),2017.06.29,등록결정(일반)
마이크로 LED를 이용한 디스플레이 장치 및 이를 이용한 모듈형 디스플레이 장치(DISPLAY DEVICE USING MICRO LED AND MODULE-TYPE DISPLAY DEVICE USING SAME),엘지전자 주식회사(서울특별시 영등포구...),2020.07.29,
UV LED 조사모듈을 가지는 팬하우징이 있는 공기조화기(AIR CONDITIONER INCLUDING FAN HAVING UV LED IRRADIATING MODULE),엘지전자 주식회사(서울특별시 영등포구...),2022.01.07,
베젤리스 마이크로LED 표시장치(MICRO LED DISPLAY DEVICE WHITOUT BEZZEL),엘지디스플레이 주식회사(서울특별시 영등포구...),2017.12.08,
UV LED 및 도광막대를 갖는 정수기(WATER PURIFIER HAVING UV LED AND LIGHT GUIDE STICK),엘지이노텍 주식회사(서울특별시 강서구...),2010.10.11,등록결정(재심사후)
베젤리스 마이크로LED 표시장치(MICRO LED DISPLAY DEVICE WHITOUT BEZEL),엘지디스플레이 주식회사(서울특별시 영등포구...),2017.12.08,
마이크로-LED 표시장치 및 그 제조방법(Micro-LED display device and method of fabricating the same),엘지디스플레이 주식회사(서울특별시 영등포구...),2017.08.30,등록결정(일반)
UV LED 및 도광막대를 갖는 정수기(WATER PURIFIER HAVING UV LED AND LIGHT GUIDE STICK),엘지이노텍 주식회사(서울특별시 강서구...),2010.10.11,등록결정(재심사후)
마이크로 LED를 이용한 디스플레이 장치 및 이의 제조 방법(DISPLAY DEVICE USING MICRO LED AND MANUFACTURING METHOD THEREOF),엘지전자 주식회사(서울특별시 영등포구...),2019.10.22,
LED 조명장치(LED APPARATUS),엘지이노텍 주식회사(서울특별시 강서구...),2017.07.11,등록결정(일반)
마이크로 LED를 이용한 디스플레이 장치 및 이의 제조 방법(DISPLAY DEVICE USING MICRO LED AND MANUFACTURING METHOD THEREOF),엘지전자 주식회사(서울특별시 영등포구...),2019.10.22,
마이크로 LED를 이용한 디스플레이 장치 및 이의 제조 방법(DISPLAY DEVICE USING MICRO LED AND MANUFACTURING METHOD THEREOF),엘지전자 주식회사(서울특별시 영등포구...),2019.10.07,
PCB 상에 LED 소자를 포함하고 있는 전지모듈(Battery Module Containing LED Element On PCB),주식회사 엘지화학(서울특별시 영등포구...),2012.10.29,등록결정(일반)
마이크로 LED를 이용한 디스플레이 장치 및 이의 제조 방법(DISPLAY DEVICE USING MICRO LED AND MANUFACTURING METHOD THEREOF),엘지전자 주식회사(서울특별시 영등포구...),2019.10.01,
마이크로 LED를 이용한 디스플레이 장치 및 이의 제조 방법(DISPLAY DEVICE USING MICRO LED AND MANUFACTURING METHOD THEREOF),엘지전자 주식회사(서울특별시 영등포구...),2019.09.24,
센서를 포함하는 LED 표시장치(Light emitting diode(LED) display device including sensor),엘지디스플레이 주식회사(서울특별시 영등포구...),2019.11.13,
LED 표시장치(Light emitting diode(LED) display device),엘지디스플레이 주식회사(서울특별시 영등포구...),2019.10.14,
마이크로 LED를 이용한 디스플레이 장치 및 이의 제조 방법(DISPLAY DEVICE USING MICRO LED AND MANUFACTURING METHOD THEREOF),엘지전자 주식회사(서울특별시 영등포구...),2019.09.18,
백라이트 유닛의 LED 구동 모듈 및 방법(Module and method for driving LED of back light unit),엘지디스플레이 주식회사(서울특별시 영등포구...),2015.12.31,
LED 구동 회로(LED Driving Circuit),엘지이노텍 주식회사(서울특별시 강서구...),2009.08.18,등록결정(일반)
다채널 LED의 정전류 제어 장치와 이를 이용한 액정표시장치(APPARATUS FOR CONTROLLING CONSTANT CURRENT FOR MULTI-CHANNEL LED AND LIQUID CRYSTAL DISPLAY USING THE SAME),엘지디스플레이 주식회사(서울특별시 영등포구...),2011.11.08,등록결정(일반)
플렉서블 LED 필름 모듈(FLEXIBLE LED FILM MODULE),엘지전자 주식회사(서울특별시 영등포구...),2018.10.26,
LED 드라이버(LED Driver),엘지이노텍 주식회사(서울특별시 강서구...),2009.05.29,등록결정(일반)
LED 패널을 갖는 가전제품 및 조명장치(home appliance and a lighting device having a LED pannel),엘지전자 주식회사(서울특별시 영등포구...),2016.07.28,
마이크로LED 표시장치 및 그 구동방법(MICRO LED DISPLAY DEVICE AND METHOD OF DRIVING THEREOF),엘지디스플레이 주식회사(서울특별시 영등포구...),2017.12.20,
"LED용 광학 렌즈와, 이를 포함하는 백라이트 유닛 및 액정표시장치(OPTICAL LENS FOR LED AND BACKLIGHT UNIT AND LIQUID CRYSTAL DISPLAY DEVICE HAVING THE SAME)",엘지디스플레이 주식회사(서울특별시 영등포구...),2016.11.23,
마이크로 LED 표시 장치(Micro-LED display device),엘지디스플레이 주식회사(서울특별시 영등포구...),2021.06.02,등록결정(일반)
마이크로 LED를 이용한 디스플레이 장치 및 이의 제조 방법(DISPLAY DEVICE USING MICRO LED AND MANUFACTURING METHOD THEREOF),엘지전자 주식회사(서울특별시 영등포구...),2019.08.26,
마이크로 LED를 이용한 디스플레이 장치 및 이의 제조 방법(DISPLAY DEVICE USING MICRO LED AND MANUFACTURING METHOD THEREOF),엘지전자 주식회사(서울특별시 영등포구...),2019.08.28,
마이크로 LED를 이용한 디스플레이 장치 및 이의 제조 방법(DISPLAY DEVICE USING MICRO LED AND MANUFACTURING METHOD THEREOF),엘지전자 주식회사(서울특별시 영등포구...),2019.08.20,
마이크로 LED를 이용한 디스플레이 장치 및 이의 제조 방법(DISPLAY DEVICE USING MICRO LED AND MANUFACTURING METHOD THEREOF),엘지전자 주식회사(서울특별시 영등포구...),2019.08.20,
마이크로LED 표시장치(MICRO LED DISPLAY DEVICE),엘지디스플레이 주식회사(서울특별시 영등포구...),2017.12.13,등록결정(일반)
마이크로 LED 표시 패널 및 그 제조 방법(MICRO LED DISPLAY PANEL AND METHOD OF MANUFACTURING THE SAME),엘지디스플레이 주식회사(서울특별시 영등포구...),2017.12.22,
마이크로LED 표시장치(MICRO LED DISPLAY DEVICE),엘지디스플레이 주식회사(서울특별시 영등포구...),2017.12.18,
LED 선택전압 구동 회로(LED selected voltage driver circuit),엘지이노텍 주식회사(서울특별시 강서구...),2015.12.28,
LED 구동 회로(LED Driving Circuit),엘지이노텍 주식회사(서울특별시 강서구...),2009.08.19,등록결정(일반)
"LED 어셈블리, 이를 포함하는 백라이트 유닛 및 액정표시장치(LED ASSEMBLY, BACKLIGHT UINT AND LIQUID CRYSTAL DISPLAY COMPRISING OF THE SAME)",엘지디스플레이 주식회사(서울특별시 영등포구...),2010.12.28,등록결정(일반)
LED 전원 장치(Power supply apparatus of LED),엘지이노텍 주식회사(서울특별시 강서구...),2010.07.15,등록결정(일반)
"LED전원제어방법, 상기 LED전원제어방법을 사용하는 LED 전원제어장치 및 LED 구동시스템(Method for controlling the Light emitting Diode supply power and LED supply power control device and system using the method)",엘지이노텍 주식회사(서울특별시 강서구...),2010.11.26,등록결정(일반)
LED 패키지 및 이를 포함하는 백라이트 유닛(LED PACKAGE AND BACK LIGHT UNIT HAVING THE SAME),엘지디스플레이 주식회사(서울특별시 영등포구...),2012.12.28,등록결정(일반)
LED 구동회로(LED driving circuit),엘지이노텍 주식회사(서울특별시 강서구...),2011.10.17,등록결정(일반)
LED 전원 장치(Power supply apparatus of LED),엘지이노텍 주식회사(서울특별시 강서구...),2010.07.23,등록결정(일반)
LED구동 장치 및 방법(Apparatus and method for driving LED),엘지전자 주식회사(서울특별시 영등포구...),2010.12.21,거절결정(일반)
UV LED를 이용한 자외선 살균 장치 및 시스템과 그 운용 방법(Apparatus and system for sterilizing using UV LED and method of operating the same),주식회사 엘지유플러스(서울특별시 용산구...),2021.01.19,
UV LED를 갖는 가습기(HUMIDIFIER HAVING UV LED),엘지이노텍 주식회사(서울특별시 강서구...),2010.10.18,취하(심사미청구)
LED 조명장치(LED Lighting Apparatus),엘지이노텍 주식회사(서울특별시 강서구...),2011.12.19,등록결정(일반)
UV LED 및 도광막대를 갖는 가습기(HUMIDIFIER HAVING UV LED AND LIGHT GUIDE STICK),엘지이노텍 주식회사(서울특별시 강서구...),2010.10.18,거절결정(일반)
UV LED를 갖는 가습기(HUMIDIFIER HAVING UV LED),엘지이노텍 주식회사(서울특별시 강서구...),2010.10.19,거절결정(일반)
마이크로LED 표시장치(MICRO LED DISPLAY DEVICE),엘지디스플레이 주식회사(서울특별시 영등포구...),2019.08.16,
마이크로 LED 디스플레이(MICRO LED DISPLAY),주식회사 엘지화학(서울특별시 영등포구...),2020.01.09,
마이크로 LED를 이용한 디스플레이 장치 및 이의 제조 방법(DISPLAY DEVICE USING MICRO LED AND MANUFACTURING METHOD THEREOF),엘지전자 주식회사(서울특별시 영등포구...),2019.06.21,
마이크로 LED를 이용한 디스플레이 장치 및 이의 제조 방법(DISPLAY DEVICE USING MICRO LED AND MANUFACTURING METHOD THEREOF),엘지전자 주식회사(서울특별시 영등포구...),2019.06.12,
마이크로 LED를 이용한 디스플레이 장치 및 이의 제조 방법(DISPLAY DEVICE USING MICRO LED AND MANUFACTURING METHOD THEREOF),엘지전자 주식회사(서울특별시 영등포구...),2019.07.01,
마이크로 LED를 이용한 디스플레이 장치 및 이의 제조 방법(DISPLAY DEVICE USING MICRO LED AND MANUFACTURING METHOD THEREOF),엘지전자 주식회사(서울특별시 영등포구...),2019.06.11,
LED 표시장치(Light emitting diode(LED) display device),엘지디스플레이 주식회사(서울특별시 영등포구...),2019.08.29,
마이크로-LED 표시장치(micro-light emitting diode(LED) display device),엘지디스플레이 주식회사(서울특별시 영등포구...),2019.08.23,
마이크로LED 표시장치 및 그 구동방법(MICRO LED DISPLAY DEVICE AND METHOD OF DRIVING THEREOF),엘지디스플레이 주식회사(서울특별시 영등포구...),2017.12.15,등록결정(일반)
조명용 광지향 필름 및 이를 이용한 LED조명장치(LIGHT DIRECTING FILM FOR LIGHT AND LED LIGHTING APPARATUS USING THE SAME),주식회사 엘지화학(서울특별시 영등포구...),2013.06.18,등록결정(일반)
LED 프로젝션 시스템의 LED 소자 방열장치(LED COOLING APPARATUS OF LED PROJECTION SYSTEM),엘지전자 주식회사(서울특별시 영등포구...),2007.09.03,등록결정(취소환송후)
LED 조명기구(LED Lighting Device),엘지전자 주식회사(서울특별시 영등포구...),2010.06.24,등록결정(일반)
프로젝션 시스템의 발광 다이오드(LED) 조명장치(LED LIGHT DEVICE of Projection System),엘지전자 주식회사(서울특별시 영등포구...),2004.09.07,등록결정(일반)
LED 패키지 및 이를 포함하는 액정표시장치모듈(LED PACKAGE AND LCD MODULE INCLUDING THE SAME),엘지디스플레이 주식회사(서울특별시 영등포구...),2010.12.09,취하(심사미청구)
"LED 구동회로와 이를 이용한 백 라이트 유닛 및 액정표시장치(LED DRIVING CIRCUIT, BACK LIGHT AND LIQUID CRYSTAL DISPLAY DEVICE USING THE SAME)",엘지디스플레이 주식회사(서울특별시 영등포구...),2007.11.27,등록결정(일반)
ESD 보호층을 포함한 LED 용 기판 및 이를 이용한 LED 패키지 및 이의 제조방법(SUBSTRATE FOR LIGHT EMITTING DIODE COMPRISING ELECTROSTATIC DISCHARGE PROTECT LAYER AND LED PACKAGE USING THE SAME AND MANUFACTURING METHOD THEREOF),엘지이노텍 주식회사(서울특별시 강서구...),2010.01.20,등록결정(일반)
LED 패키지 및 이를 포함하는 백라이트 유닛(LED PAKAGE AND BACKLIGHT UNIT INCLUDING THE SAME),엘지디스플레이 주식회사(서울특별시 영등포구...),2010.11.17,취하(등록결정전 취하서제출)
LED 패키지(LED Package),엘지이노텍 주식회사(서울특별시 강서구...),2006.02.23,등록결정(심사전치후)
고출력 LED 패키지(High Power LED Package),엘지전자 주식회사(서울특별시 영등포구...),2004.06.10,등록결정(일반)
LED 모듈 및 이를 구비하는 백라이트 유닛(LED module and backlight unit having the same),엘지이노텍 주식회사(서울특별시 강서구...),2007.03.19,원결정유지(심사전치)
LED 면광원 및 이를 이용한 투사표시장치(LED suface emitting source and projection displaysystem of the same),엘지전자 주식회사(서울특별시 영등포구...),2004.10.04,등록결정(심사전치후)
"LED 패키지 및 그 제조방법과 LED 패키지를 갖는 광원 유닛(Light Emitting Diode Pakage, Method for Manufacturing the Same and Light Source Unit Having the LED Pakage)",엘지디스플레이 주식회사(서울특별시 영등포구...),2009.02.17,등록결정(일반)
LED 조명용 전원 장치(POWER APPARATUS FOR LED LIGHTING),엘지이노텍 주식회사(서울특별시 강서구...),2016.01.21,
LED TV용 전원장치의 스탠바이 전원회로(Stand-by power circuit in a power supply for a LED television),엘지이노텍 주식회사(서울특별시 강서구...),2010.05.28,등록결정(일반)
LED 구동 회로(LED DRVING CIRCUIT),엘지이노텍 주식회사(서울특별시 강서구...),2009.08.28,등록결정(일반)
LCD 패널용 LED 드라이버의 OVP 검출회로(circuit for detecting OVP of LED driver for LCD panel),엘지이노텍 주식회사(서울특별시 강서구...),2006.04.17,등록결정(일반)
LED 구동 회로(LED DRIVING CIRCUIT),엘지이노텍 주식회사(서울특별시 강서구...),2009.08.28,등록결정(일반)
LED 표시장치(Light emitting diode(LED) display device),엘지디스플레이 주식회사(서울특별시 영등포구...),2019.07.24,
LED 프로젝터 및 LED 제어 방법(LED projector and method of controlling LED),엘지전자 주식회사(서울특별시 영등포구...),2009.09.07,등록결정(일반)
에칭에 의해 형성된 캐비티를 포함하는 LED 패키지 및 그 제조 방법(LED PACKAGE COMPRISING CAVITY FORMED BY ETCHING AND MANUFACTURING METHOD OF THE SAME),엘지이노텍 주식회사(서울특별시 강서구...),2010.08.19,등록결정(재심사후)
LED 램프와 이를 구비한 백라이트 유닛(LED lamp and backlight unit having the same),엘지디스플레이 주식회사(서울특별시 영등포구...),2007.03.30,등록결정(일반)
LED 구동 회로(LED Driving Circuit),엘지이노텍 주식회사(서울특별시 강서구...),2009.09.08,등록결정(일반)
LED 구동회로(LED DRIVING CIRCUIT),엘지이노텍 주식회사(서울특별시 강서구...),2009.05.07,등록결정(일반)
LED 백라이트를 사용하는 액정표시소자의가요성인쇄회로기판의 구조(STRUCTURE OF FLEXIBLE PRINTED CIRCUIT OF LIQUID CRYSTALDISPLAY DEVICE USING LED BACK LIGHT),엘지디스플레이 주식회사(서울특별시 영등포구...),2005.10.11,등록결정(일반)
휘도 조절 렌즈 및 이를 이용하는 LED 패키지(LENS FOR ADJUSTING BRIGHTNESS AND LED PACKAGE USING THESAME),엘지전자 주식회사(서울특별시 영등포구...),2006.04.28,등록결정(일반)
"그라비아 오프셋 방식을 이용한 LED용 도광판 제조방식 및 이의 제조방법(LIGHT GUIDE PLATE FOR LED USING GRAVURE-OFFSET METHOD, AND THE PROCESS OF MANUFACTURING THE SAME)",주식회사 엘지화학(서울특별시 영등포구...),2010.07.08,등록결정(재심사후)
마이크로 LED를 이용한 디스플레이 장치 및 이의 제조 방법(DISPLAY DEVICE USING MICRO LED AND MANUFACTURING METHOD THEREOF),엘지전자 주식회사(서울특별시 영등포구...),2019.07.09,
마이크로 LED를 이용한 디스플레이 장치 및 이의 제조 방법(DISPLAY DEVICE USING MICRO LED AND MANUFACTURING METHOD THEREOF),엘지전자 주식회사(서울특별시 영등포구...),2019.07.19,
와이어 파손 방지용 LED 패키지 구조(LED Package Structure For Preventing Wire-Break),엘지이노텍 주식회사(서울특별시 강서구...),2009.06.02,등록결정(일반)
"LED 패키지, 백라이트 유닛 및 액정 표시 장치(LED Packages, Backlight Units and Liquid Crystal Display Devices)",엘지디스플레이 주식회사(서울특별시 영등포구...),2015.07.29,등록결정(일반)
LED 백라이트를 이용한 액정디스플레이 장치 및 화면분할 구동 방법(Liquid Crystal Display using LED backlight and method for local dimming thereof),엘지전자 주식회사(서울특별시 영등포구...),2009.06.16,등록결정(일반)
LED 필름(LED FILM),엘지전자 주식회사(서울특별시 영등포구...),2018.09.13,
"LED 조명 장치, 그리고 그의 조광 제어 방법(LED LIGHTING DEVICE, AND LIGHT CONTROL METHOD OF THE SAME)",엘지이노텍 주식회사(서울특별시 강서구...),2017.07.21,등록결정(일반)
LED 드라이버(LED Driver),엘지이노텍 주식회사(서울특별시 강서구...),2009.05.29,등록결정(일반)
LED 드라이버(LED Driver),엘지이노텍 주식회사(서울특별시 강서구...),2009.06.25,등록결정(일반)
"LED 어레이 및 이의 제조방법, LED 백라이트 유닛을 구비하는 액정표시장치모듈(LED ARRAY AND FABRICATING METHOD OF THE SAME, LCD MOUDLE INCLUDING LED BACKLIGHT UNIT)",엘지디스플레이 주식회사(서울특별시 영등포구...),2011.08.04,등록결정(일반)
세탁장치 및 세탁장치의 LED 제어 방법(Washing machine and LED controlling method thereof),엘지전자 주식회사(서울특별시 영등포구...),2009.02.18,취하(심사미청구)
LED 스트링 구동 장치(LED string driving apparatus),엘지이노텍 주식회사(서울특별시 강서구...),2010.05.14,등록결정(일반)
완충층이 형성된 LED 패키지 및 그 제조 방법(LED PACKAGE COMPRISING BUFFER LAYER AND MANUFACTURING METHOD OF THE SAME),엘지이노텍 주식회사(서울특별시 강서구...),2010.03.17,등록결정(일반)
LED 패키지 및 그 제조방법(LED PACKAGE AND MANUFACTURING METHOD OF THE SAME),엘지이노텍 주식회사(서울특별시 강서구...),2010.03.17,등록결정(일반)
LED 백 라이트 시스템 및 그의 초기 설정방법(LED BACK LIGHT SYSTEM AND INITIAL SETTING UP METHOD THEREOF),엘지디스플레이 주식회사(서울특별시 영등포구...),2007.04.20,등록결정(일반)
마이크로LED 표시장치 제조방법(METHOD OF FABRICATING MICRO LED DISPLAY DEVICE),엘지디스플레이 주식회사(서울특별시 영등포구...),2017.12.26,등록결정(재심사후)
LED 램프와 이를 구비한 백라이트 유닛(LED LAMP AND BACKLIGHT UNIT HAVING THE SAME),엘지디스플레이 주식회사(서울특별시 영등포구...),2006.04.26,등록결정(일반)
LED 백라이트 유닛 및 이를 이용한 액정표시장치(Module for light guide plate and LED back-light unit using the same),엘지전자 주식회사(서울특별시 영등포구...),2009.06.15,등록결정(일반)
LED 디스플레이 장치 및 그 제조 방법(LED DISPLAY APPARATUS AND METHOD FOR MANUFACTURING THE SAME),엘지전자 주식회사(서울특별시 영등포구...),2011.10.26,등록결정(일반)
UV LED 조사모듈을 가지는 팬하우징이 있는 공기조화기(AIR CONDITIONER INCLUDING FAN HAVING UV LED IRRADIATING MODULE),엘지전자 주식회사(서울특별시 영등포구...),2019.08.30,거절결정(재심사)
마이크로 LED를 이용한 디스플레이 장치 및 이의 제조 방법(DISPLAY DEVICE USING MICRO LED AND MANUFACTURING METHOD THEREOF),엘지전자 주식회사(서울특별시 영등포구...),2020.07.01,
시간 지연 회로가 구비된 LED 구동 장치(LED driver provided with time delay circuit),엘지이노텍 주식회사(서울특별시 강서구...),2016.01.05,취하(심사미청구)
LED 구동 드라이버 및 그 구동방법(DRIVER FOR DRIVING LED AND METHOD OF DRIVING LED),엘지이노텍 주식회사(서울특별시 강서구...),2016.12.07,
과전압보호회로를 구비한 LED 조명장치(LED APPARATUS HAVING OVER VOLTAGE PROTECTION CIRCUIT),엘지이노텍 주식회사(서울특별시 강서구...),2016.09.07,취하(심사미청구)
LED 조명 제어 모듈(LED lamp control module),엘지이노텍 주식회사(서울특별시 강서구...),2015.06.01,취하(심사미청구)
LED장치 보호회로(PROTECTION CIRCUIT FOR LED APPARATUS),엘지이노텍 주식회사(서울특별시 강서구...),2015.05.15,취하(심사미청구)
LED 어레이 및 이를 포함하는 액정표시장치(LED ARRAY AND LIQUID CRYSTAL DISPLAY DEVICE INCULDING THE SAME),엘지디스플레이 주식회사(서울특별시 영등포구...),2015.01.22,등록결정(일반)
LED 조명용 전원 장치(Power device for LED lighting),엘지이노텍 주식회사(서울특별시 강서구...),2015.04.21,등록결정(일반)
LED 구동회로(LED driving circuit),엘지전자 주식회사(서울특별시 영등포구...),2014.12.31,등록결정(일반)
LED 전력 제어 장치(APPARATUS FOR LED POWER CONTROL),엘지이노텍 주식회사(서울특별시 강서구...),2010.04.10,등록결정(일반)
